{
  "$schema": "bopen://schemas/governance/pg-g0-bound-tree-readiness/0.2.0-draft",
  "projection_id": "PG-G0-BOUND-TREE-READINESS-002",
  "version": "0.2.0-draft",
  "status": "NOT_READY",
  "generated_at": "2026-07-22T00:00:00+07:00",
  "historical_view": {
    "authority_readiness_input": {
      "path": "artifacts/validation/program-g0-authority-readiness.json",
      "mode": "100644",
      "type": "blob",
      "blob_oid": "27483f81ce60f0469c001738f2d98928717059ba",
      "bytes": 1451,
      "sha256": "d444da84d8ed06c5bc1852f0c581d1ba63a27962d3f56e402dcc3e2b5dbe242a"
    },
    "docket_input": {
      "path": "docs/00-governance/authority-dockets/PG-G0-AUTH-001.json",
      "mode": "100644",
      "type": "blob",
      "blob_oid": "12f6fc595ab6a911efca243716b35f9c03e39df0",
      "bytes": 12851,
      "sha256": "255fd6ae1b88de89b5a89d9575c5e97b4417115b4985a18426414b8003773795"
    },
    "docket_bound_commit_sha": "c893062c197e74c15214e5ce1c425b9e9ed8002f",
    "docket_bound_tree_sha": "f336976981c9b7e95c96ec8289589e53c1ac506c",
    "blocker_count": 18,
    "rejected_projection_ref": "artifacts/validation/pg-g0-current-tree-readiness-001.json",
    "rejected_projection_status": "REJECTED_REQUEST_CHANGES"
  },
  "subject_tree": {
    "repository_ref": "bstBizEra/bopen",
    "commit_sha": "4a98cb45748ded2b209786bcb9242664aa0795aa",
    "tree_sha": "8900b871e1f436d5ee21919764a31f955f42d5bf",
    "commit_object_verified": true,
    "tree_object_verified": true,
    "root_controls_valid": true,
    "root_control_errors": [],
    "root_controls": [
      {
        "path": "Roadmap.md",
        "mode": "100644",
        "type": "blob",
        "blob_oid": "200f6ecebb4d0703cc7c643503640b1877a64a80",
        "bytes": 2805,
        "sha256": "9039fe3a2d1f77cd8a30c050bbcb2d0c29031ce979ecef380c307f548802f1a8",
        "metadata_valid": true
      },
      {
        "path": "Master_Standards.md",
        "mode": "100644",
        "type": "blob",
        "blob_oid": "fcd4baf63b80364ed85cbb377ba68d32582a1ed3",
        "bytes": 3070,
        "sha256": "b1d837a156e68bd2cab0359804b4294c855f52187fd2d3f1eaf3f6cbfe8ede06",
        "metadata_valid": true
      },
      {
        "path": "Progress_Log.md",
        "mode": "100644",
        "type": "blob",
        "blob_oid": "4befd0f32fce9e5e257c752b05aad245ecd43435",
        "bytes": 2612,
        "sha256": "4a6a71304d376e14df8e00ae848da95caa88da56813f258c5b885db0aecd11fe",
        "metadata_valid": true
      },
      {
        "path": "Backlog.md",
        "mode": "100644",
        "type": "blob",
        "blob_oid": "231a239844aa9ac383c7e93de57cb9a617e80673",
        "bytes": 2507,
        "sha256": "eb3f2b1761f59212d700b85b88e37d03c9bf6025141cfa729d1706e37144da67",
        "metadata_valid": true
      },
      {
        "path": "Recap_Today.md",
        "mode": "100644",
        "type": "blob",
        "blob_oid": "5b17c8d751cf7fbce12d415d205e74fdb547f6c5",
        "bytes": 2601,
        "sha256": "e753681eef38d5361128d3b31021debe17417445d7b19b2178d6991dcfd999e7",
        "metadata_valid": true
      }
    ]
  },
  "carrier_provenance": {
    "base_commit_sha": "bb64ba60345539d5f592d0b99d066240d813d7ae",
    "base_tree_sha": "832cf238be3721d1efaa3b7526c9f297738d60fa",
    "subject_is_ancestor_of_carrier": true,
    "carrier_is_ancestor_of_head": true,
    "live_worktree_bytes_used": false
  },
  "blocker_assessments": [
    {
      "blocker_id": "PG-G0-HIST-001",
      "original_text": "BOPEN-GOV-001 and the authority matrix are draft and ineffective",
      "original_sha256": "6b60d5707f5368928fefc53b6ef5394323adfd349b1a51342c9dab9fb3cd228a",
      "classification": "HUMAN_DISPOSITION_REQUIRED",
      "current_observation": "This blocker requires attributable human disposition or an effective authority source and cannot be machine-resolved.",
      "machine_evidence_refs": [
        "4a98cb45748ded2b209786bcb9242664aa0795aa:docs/00-governance/authority-dockets/PG-G0-AUTH-001.json"
      ]
    },
    {
      "blocker_id": "PG-G0-HIST-002",
      "original_text": "DEC-0004, DEC-0005, ADR-0005 and ADR-0009 lack named checkers and due dates",
      "original_sha256": "b3f750372045da14df74427be5d6ee985c9da606133fa2b7186339a5f1be028a",
      "classification": "HUMAN_DISPOSITION_REQUIRED",
      "current_observation": "This blocker requires attributable human disposition or an effective authority source and cannot be machine-resolved.",
      "machine_evidence_refs": [
        "4a98cb45748ded2b209786bcb9242664aa0795aa:docs/00-governance/authority-dockets/PG-G0-AUTH-001.json"
      ]
    },
    {
      "blocker_id": "PG-G0-HIST-003",
      "original_text": "GOV-P0-01 and DEC-0010 remain proposed and BOOT-B7 remains pending",
      "original_sha256": "1ede0883b3889815c869bc3c3c8fdc93fad3c3699ddedf608a70bf10d459bae4",
      "classification": "HUMAN_DISPOSITION_REQUIRED",
      "current_observation": "This blocker requires attributable human disposition or an effective authority source and cannot be machine-resolved.",
      "machine_evidence_refs": [
        "4a98cb45748ded2b209786bcb9242664aa0795aa:docs/00-governance/authority-dockets/PG-G0-AUTH-001.json"
      ]
    },
    {
      "blocker_id": "PG-G0-HIST-004",
      "original_text": "PG-G0-DEC-001 remains ineffective",
      "original_sha256": "b5558efdebfdb469acd1d4b1f2a034dd323a60de9386989687ccf579877d4d7b",
      "classification": "HUMAN_DISPOSITION_REQUIRED",
      "current_observation": "This blocker requires attributable human disposition or an effective authority source and cannot be machine-resolved.",
      "machine_evidence_refs": [
        "4a98cb45748ded2b209786bcb9242664aa0795aa:docs/00-governance/authority-dockets/PG-G0-AUTH-001.json"
      ]
    },
    {
      "blocker_id": "PG-G0-HIST-005",
      "original_text": "PG-G0-DEC-002 remains ineffective",
      "original_sha256": "b0fccfb5ba638447e5a5cd0b8560904057cbe940a980e9794af0da792a64fcc0",
      "classification": "HUMAN_DISPOSITION_REQUIRED",
      "current_observation": "This blocker requires attributable human disposition or an effective authority source and cannot be machine-resolved.",
      "machine_evidence_refs": [
        "4a98cb45748ded2b209786bcb9242664aa0795aa:docs/00-governance/authority-dockets/PG-G0-AUTH-001.json"
      ]
    },
    {
      "blocker_id": "PG-G0-HIST-006",
      "original_text": "PG-G0-DEC-003 remains ineffective",
      "original_sha256": "f9b235f9eda657f2a9ea820b87e56f50502bf69dbcbf62dec9be06a53744a0ca",
      "classification": "HUMAN_DISPOSITION_REQUIRED",
      "current_observation": "This blocker requires attributable human disposition or an effective authority source and cannot be machine-resolved.",
      "machine_evidence_refs": [
        "4a98cb45748ded2b209786bcb9242664aa0795aa:docs/00-governance/authority-dockets/PG-G0-AUTH-001.json"
      ]
    },
    {
      "blocker_id": "PG-G0-HIST-007",
      "original_text": "PG-G0-DEC-004 remains ineffective",
      "original_sha256": "d6dceb6a81779767ba355e12508eb39482f3a48d35990fd426157dd39460faa6",
      "classification": "HUMAN_DISPOSITION_REQUIRED",
      "current_observation": "This blocker requires attributable human disposition or an effective authority source and cannot be machine-resolved.",
      "machine_evidence_refs": [
        "4a98cb45748ded2b209786bcb9242664aa0795aa:docs/00-governance/authority-dockets/PG-G0-AUTH-001.json"
      ]
    },
    {
      "blocker_id": "PG-G0-HIST-008",
      "original_text": "PG-G0-DEC-005 remains ineffective",
      "original_sha256": "6c6f454168f7e3795178946b80cf55400e57e9f62fd48a8193469512c491aa71",
      "classification": "HUMAN_DISPOSITION_REQUIRED",
      "current_observation": "This blocker requires attributable human disposition or an effective authority source and cannot be machine-resolved.",
      "machine_evidence_refs": [
        "4a98cb45748ded2b209786bcb9242664aa0795aa:docs/00-governance/authority-dockets/PG-G0-AUTH-001.json"
      ]
    },
    {
      "blocker_id": "PG-G0-HIST-009",
      "original_text": "Roadmap.md, Master_Standards.md, Progress_Log.md, Backlog.md and Recap_Today.md are absent and no equivalents are approved",
      "original_sha256": "42505be835807dce077ea94770472e6cfba0266e7a6adf8b8a77234496dca446",
      "classification": "RESOLVED_TECHNICALLY_IN_SUBJECT_TREE",
      "current_observation": "The five exact root-control blobs in the bound subject tree pass mode, type, byte and metadata checks.",
      "machine_evidence_refs": [
        "4a98cb45748ded2b209786bcb9242664aa0795aa:Roadmap.md",
        "4a98cb45748ded2b209786bcb9242664aa0795aa:Master_Standards.md",
        "4a98cb45748ded2b209786bcb9242664aa0795aa:Progress_Log.md",
        "4a98cb45748ded2b209786bcb9242664aa0795aa:Backlog.md",
        "4a98cb45748ded2b209786bcb9242664aa0795aa:Recap_Today.md"
      ]
    },
    {
      "blocker_id": "PG-G0-HIST-010",
      "original_text": "an approved authority identity registry with hash-bound human role records is absent",
      "original_sha256": "2f0debcdeff148863b4cd6e85bd6dcc0925e8e4e7eaafd6e9523b3aeb1b72af0",
      "classification": "HUMAN_DISPOSITION_REQUIRED",
      "current_observation": "This blocker requires attributable human disposition or an effective authority source and cannot be machine-resolved.",
      "machine_evidence_refs": [
        "4a98cb45748ded2b209786bcb9242664aa0795aa:docs/00-governance/authority-dockets/PG-G0-AUTH-001.json"
      ]
    },
    {
      "blocker_id": "PG-G0-HIST-011",
      "original_text": "attributable Product, Architecture, Security, Data and Engineering human authority identities are absent",
      "original_sha256": "67d2480189b0a5a3e206e351a0042dcfc15c1cf8f32ebb7a52bd71fef349cebd",
      "classification": "HUMAN_DISPOSITION_REQUIRED",
      "current_observation": "This blocker requires attributable human disposition or an effective authority source and cannot be machine-resolved.",
      "machine_evidence_refs": [